{
 "generated_at": "2026-10-18T11:45:25Z",
 "title": "Where Starship should land",
 "method": "Every 0.125 degree cell between -60 and 60 degrees latitude (about 7 km) gets four checks from public orbital data: ice within reach and low ground from SpaceX's stated criteria, plume-safe ground and science reach from us. Each check is go, watch or no-go with a 0 to 1 goodness; a cell's status is its worst check, the same rule as a farm's flag on Earth; the score is the weighted mean of goodness (ice 0.35, low_elevation 0.20, plume_safe_ground 0.25, science_reach 0.20). Sunlight, latitude and landing-scale rock hazards are shown but not scored: SpaceX screens for them and HiRISE is the right tool. Sites are the best go cells at least 300 km apart.",
 "grid": {
  "cell_deg": 0.125,
  "lat_min": -60,
  "lat_max": 60,
  "lon_convention": "east-positive, -180..180",
  "latitude": "planetocentric",
  "rows": 960,
  "cols": 2880
 },
 "factors": [
  {
   "id": "ice",
   "name": "Ice within reach",
   "from": "spacex",
   "dataset": "SWIM ice consistency, 0-1 m and 1-5 m (PSI)",
   "why": "Water for propellant, air and crops.",
   "go": "0-1 m consistency >= 0.25, or 1-5 m consistency >= 0.5",
   "watch": "0-1 m consistency >= 0, or 1-5 m consistency >= 0.25",
   "no_go": "otherwise",
   "goodness_rule": "max((c01 + 1) / 2, 0.85 x (c15 + 1) / 2)",
   "weight": 0.35
  },
  {
   "id": "low_elevation",
   "name": "Low ground",
   "from": "spacex",
   "dataset": "MOLA MEGDR elevation, 16 pixels per degree (NASA PDS)",
   "why": "More atmosphere to slow the ship.",
   "go": "elevation <= -2,500 m",
   "watch": "elevation <= 0 m",
   "no_go": "above 0 m",
   "goodness_rule": "1 at -4,000 m or lower, 0 at +1,000 m or higher, linear between",
   "weight": 0.2
  },
  {
   "id": "plume_safe_ground",
   "name": "Plume-safe ground",
   "from": "ours",
   "dataset": "MGS TES nighttime thermal inertia, 20 pixels per degree (Putzig and Mellon, PSI)",
   "why": "Firm soil the engines will not dig out: very low inertia is loose dust, very high is rock and bedrock.",
   "go": "180 <= TI <= 500",
   "watch": "120 <= TI < 180, or 500 < TI <= 700",
   "no_go": "TI < 120 (loose dust) or TI > 700 (rock, bedrock)",
   "goodness_rule": "trapezoid: 0 at 80, 1 from 180 to 500, 0 at 800",
   "weight": 0.25
  },
  {
   "id": "science_reach",
   "name": "Science reach",
   "from": "ours",
   "dataset": "USGS Mars Global Geologic Map, SIM 3292 (Tanaka et al. 2014)",
   "why": "More kinds of rock within a rover's range, and rock from the wet early eras.",
   "go": ">= 4 distinct units within about 100 km, including a Noachian or Hesperian one",
   "watch": ">= 2 units",
   "no_go": "1 unit (a uniform plain)",
   "goodness_rule": "0.7 x min(1, units / 6) + 0.3 x (1 if an old unit is within reach else 0)",
   "weight": 0.2
  }
 ],
 "shown_not_scored": [
  {
   "id": "slope",
   "name": "Regional slope",
   "why": "Flat, rock-free ground is SpaceX's own screen and needs HiRISE at landing scale; a 20 km slope is context, not a verdict."
  },
  {
   "id": "latitude",
   "name": "Latitude",
   "why": "Sunlight and power are SpaceX's own screen (within about 40 degrees of the equator); we show it and leave it to them."
  },
  {
   "id": "albedo",
   "name": "Dust (albedo)",
   "why": "Bright ground usually means a dust cover; thermal inertia already scores the firmness, so albedo stays context."
  }
 ],
 "blind_spots": [
  "no sunlight or power factor (SpaceX screens for it; we leave it to them)",
  "no rock-hazard factor at landing scale (HiRISE work)",
  "7 km cells are far coarser than a landing ellipse",
  "SWIM covers 60 S to 60 N only",
  "thermal inertia is a regional average; local boulders are invisible at this scale",
  "about 15 percent of the thermal inertia map between 60 S and 60 N is the authors' interpolated fill (TES mask); those cells are flagged in the detail text"
 ],
 "stats": {
  "cells_scored": 2764800,
  "go": 37798,
  "watch": 670362,
  "no_go": 2056640,
  "no_data": 0,
  "correlations": {
   "ice vs low_elevation": 0.393,
   "ice vs plume_safe_ground": 0.322,
   "ice vs science_reach": -0.061,
   "low_elevation vs plume_safe_ground": 0.347,
   "low_elevation vs science_reach": -0.117,
   "plume_safe_ground vs science_reach": -0.003
  },
  "weights": {
   "ice": 0.35,
   "low_elevation": 0.2,
   "plume_safe_ground": 0.25,
   "science_reach": 0.2
  }
 },
 "sites": [
  {
   "lat": 52.3125,
   "lon": 167.4375,
   "status": "go",
   "score": 0.955,
   "checks": [
    {
     "factor": "ice",
     "status": "go",
     "value": 0.889,
     "unit": "consistency 0-1 m",
     "goodness": 0.945,
     "detail": "Ice within 1 m (consistency +0.89 at 0-1 m, +0.55 at 1-5 m)"
    },
    {
     "factor": "low_elevation",
     "status": "go",
     "value": -3932.25,
     "unit": "m",
     "goodness": 0.986,
     "detail": "-3,932 m: thick air to brake in"
    },
    {
     "factor": "plume_safe_ground",
     "status": "go",
     "value": 261.08,
     "unit": "J m^-2 K^-1 s^-1/2",
     "goodness": 1.0,
     "detail": "Thermal inertia 261: firm, packed ground (from the map's interpolated fill, not a direct TES measurement)"
    },
    {
     "factor": "science_reach",
     "status": "go",
     "value": 5.0,
     "unit": "units within 100 km",
     "goodness": 0.883,
     "detail": "5 rock units within about 100 km, one from the wet early eras"
    }
   ],
   "context": {
    "slope_deg": 0.12,
    "abs_latitude": 52.31,
    "albedo": 0.183
   },
   "geology": {
    "unit": "mAl",
    "age": "Amazonian",
    "units_within_100km": 5,
    "oldest_within_100km": "Noachian or Hesperian"
   },
   "id": "M01",
   "rank": 1,
   "reason": "Firm ground; few rock types within reach.",
   "nearest_spacex": {
    "id": "ESP_060707_2160",
    "km": 1008
   },
   "thumb": "thumbs/M01.jpg",
   "thumb_source": "THEMIS day IR controlled mosaic (mc07_cebrenia_nir) via USGS Astrogeology STAC"
  },
  {
   "lat": -49.4375,
   "lon": 86.0625,
   "status": "go",
   "score": 0.945,
   "checks": [
    {
     "factor": "ice",
     "status": "go",
     "value": 0.817,
     "unit": "consistency 0-1 m",
     "goodness": 0.908,
     "detail": "Ice within 1 m (consistency +0.82 at 0-1 m, +0.63 at 1-5 m)"
    },
    {
     "factor": "low_elevation",
     "status": "go",
     "value": -5600.0,
     "unit": "m",
     "goodness": 1.0,
     "detail": "-5,600 m: thick air to brake in"
    },
    {
     "factor": "plume_safe_ground",
     "status": "go",
     "value": 283.56,
     "unit": "J m^-2 K^-1 s^-1/2",
     "goodness": 1.0,
     "detail": "Thermal inertia 284: firm, packed ground (from the map's interpolated fill, not a direct TES measurement)"
    },
    {
     "factor": "science_reach",
     "status": "go",
     "value": 5.0,
     "unit": "units within 100 km",
     "goodness": 0.883,
     "detail": "5 rock units within about 100 km, one from the wet early eras"
    }
   ],
   "context": {
    "slope_deg": 2.21,
    "abs_latitude": 49.44,
    "albedo": 0.193
   },
   "geology": {
    "unit": "mNh",
    "age": "Noachian",
    "units_within_100km": 5,
    "oldest_within_100km": "Noachian or Hesperian"
   },
   "id": "M02",
   "rank": 2,
   "reason": "Thick air to brake in; few rock types within reach.",
   "nearest_spacex": {
    "id": "ESP_060707_2160",
    "km": 6453
   },
   "thumb": "thumbs/M02.jpg",
   "thumb_source": "THEMIS day IR controlled mosaic (mc28_hellas_nir) via USGS Astrogeology STAC"
  },
  {
   "lat": -52.0625,
   "lon": 78.3125,
   "status": "go",
   "score": 0.942,
   "checks": [
    {
     "factor": "ice",
     "status": "go",
     "value": 0.803,
     "unit": "consistency 0-1 m",
     "goodness": 0.902,
     "detail": "Ice within 1 m (consistency +0.80 at 0-1 m, +0.43 at 1-5 m)"
    },
    {
     "factor": "low_elevation",
     "status": "go",
     "value": -5634.75,
     "unit": "m",
     "goodness": 1.0,
     "detail": "-5,635 m: thick air to brake in"
    },
    {
     "factor": "plume_safe_ground",
     "status": "go",
     "value": 278.12,
     "unit": "J m^-2 K^-1 s^-1/2",
     "goodness": 1.0,
     "detail": "Thermal inertia 278: firm, packed ground"
    },
    {
     "factor": "science_reach",
     "status": "go",
     "value": 5.0,
     "unit": "units within 100 km",
     "goodness": 0.883,
     "detail": "5 rock units within about 100 km, one from the wet early eras"
    }
   ],
   "context": {
    "slope_deg": 0.55,
    "abs_latitude": 52.06,
    "albedo": 0.165
   },
   "geology": {
    "unit": "lNv",
    "age": "Noachian",
    "units_within_100km": 5,
    "oldest_within_100km": "Noachian or Hesperian"
   },
   "id": "M03",
   "rank": 3,
   "reason": "Thick air to brake in; few rock types within reach.",
   "nearest_spacex": {
    "id": "ESP_060707_2160",
    "km": 6782
   },
   "thumb": "thumbs/M03.jpg",
   "thumb_source": "THEMIS day IR controlled mosaic (mc28_hellas_nir) via USGS Astrogeology STAC"
  },
  {
   "lat": 59.9375,
   "lon": -82.3125,
   "status": "go",
   "score": 0.933,
   "checks": [
    {
     "factor": "ice",
     "status": "go",
     "value": 0.878,
     "unit": "consistency 0-1 m",
     "goodness": 0.939,
     "detail": "Ice within 1 m (consistency +0.88 at 0-1 m, +0.59 at 1-5 m)"
    },
    {
     "factor": "low_elevation",
     "status": "go",
     "value": -3447.5,
     "unit": "m",
     "goodness": 0.89,
     "detail": "-3,448 m: thick air to brake in"
    },
    {
     "factor": "plume_safe_ground",
     "status": "go",
     "value": 211.68,
     "unit": "J m^-2 K^-1 s^-1/2",
     "goodness": 1.0,
     "detail": "Thermal inertia 212: firm, packed ground (from the map's interpolated fill, not a direct TES measurement)"
    },
    {
     "factor": "science_reach",
     "status": "go",
     "value": 5.0,
     "unit": "units within 100 km",
     "goodness": 0.883,
     "detail": "5 rock units within about 100 km, one from the wet early eras"
    }
   ],
   "context": {
    "slope_deg": 0.14,
    "abs_latitude": 59.94,